{
  "$schema": "https://json-schema.org/draft/2020-12/schema",
  "$id": "https://docs.flyto2.com/schemas/documentation-contract-v1.json",
  "title": "Flyto2 documentation contract",
  "type": "object",
  "additionalProperties": false,
  "required": [
    "schema_version",
    "repository",
    "status",
    "audiences",
    "documentation"
  ],
  "properties": {
    "$schema": { "type": "string", "minLength": 1 },
    "schema": { "type": "string", "minLength": 1 },
    "schema_version": { "const": 1 },
    "version": { "const": 1 },
    "repository": { "type": "string", "minLength": 2 },
    "status": {
      "enum": ["active", "experimental", "internal", "deprecated", "generated"]
    },
    "audiences": {
      "type": "array",
      "minItems": 1,
      "uniqueItems": true,
      "items": { "type": "string", "minLength": 2 }
    },
    "documentation": {
      "type": "object",
      "additionalProperties": {
        "oneOf": [
          { "type": "string", "minLength": 3 },
          { "$ref": "#/$defs/pathList" },
          { "type": "boolean" }
        ]
      },
      "required": ["index", "architecture", "state", "security", "changelog", "feature_reference"],
      "properties": {
        "index": { "type": "string", "minLength": 3 },
        "architecture": { "type": "string", "minLength": 3 },
        "state": { "type": "string", "minLength": 3 },
        "security": { "type": "string", "minLength": 3 },
        "changelog": { "type": "string", "minLength": 3 },
        "feature_reference": { "type": "string", "minLength": 3 },
        "whitepaper": { "type": "string", "minLength": 3 },
        "source_reference": {
          "oneOf": [
            { "type": "string", "minLength": 3 },
            { "$ref": "#/$defs/pathList" }
          ]
        },
        "source_reference_exclude": { "$ref": "#/$defs/pathList" },
        "module_roots": {
          "type": "array",
          "uniqueItems": true,
          "items": { "type": "string", "minLength": 1 }
        },
        "configuration_not_applicable": { "type": "boolean" }
      }
    },
    "source_areas": {
      "type": "array",
      "minItems": 1,
      "items": { "$ref": "#/$defs/sourceArea" }
    },
    "owners": {
      "type": "array",
      "minItems": 1,
      "items": { "$ref": "#/$defs/sourceOwner" }
    },
    "feature_surfaces": {
      "type": "array",
      "items": { "$ref": "#/$defs/featureSurface" }
    },
    "budgets": {
      "type": "object"
    }
  },
  "allOf": [
    {
      "anyOf": [
        { "required": ["source_areas"] },
        { "required": ["owners"] }
      ]
    }
  ],
  "$defs": {
    "pathList": {
      "type": "array",
      "minItems": 1,
      "uniqueItems": true,
      "items": { "type": "string", "minLength": 1 }
    },
    "sourceArea": {
      "type": "object",
      "additionalProperties": false,
      "required": ["paths", "documentation"],
      "properties": {
        "id": { "type": "string", "pattern": "^[a-z0-9][a-z0-9-]*$" },
        "name": { "type": "string", "minLength": 2 },
        "description": { "type": "string", "minLength": 30 },
        "paths": { "$ref": "#/$defs/pathList" },
        "documentation": { "$ref": "#/$defs/pathList" }
      },
      "anyOf": [
        { "required": ["id"] },
        { "required": ["name"] }
      ]
    },
    "sourceOwner": {
      "type": "object",
      "additionalProperties": false,
      "required": ["area", "paths", "docs"],
      "properties": {
        "area": { "type": "string", "minLength": 2 },
        "paths": { "$ref": "#/$defs/pathList" },
        "docs": { "$ref": "#/$defs/pathList" }
      }
    },
    "featureSurface": {
      "type": "object",
      "additionalProperties": false,
      "required": ["id", "title", "kind", "status", "description", "source", "documentation"],
      "properties": {
        "id": { "type": "string", "pattern": "^[a-z0-9][a-z0-9-]*$" },
        "title": { "type": "string", "minLength": 3 },
        "kind": {
          "enum": ["api", "cli", "configuration", "content", "governance", "library", "operations", "schema", "ui", "workflow"]
        },
        "status": {
          "enum": ["active", "experimental", "internal", "deprecated", "generated"]
        },
        "description": { "type": "string", "minLength": 40 },
        "source": { "$ref": "#/$defs/pathList" },
        "documentation": { "$ref": "#/$defs/pathList" },
        "tests": {
          "type": "array",
          "uniqueItems": true,
          "items": { "type": "string", "minLength": 1 }
        },
        "verification": {
          "type": "array",
          "uniqueItems": true,
          "items": { "type": "string", "minLength": 2 }
        }
      }
    }
  }
}
